{
  "schema_version": 1,
  "artifact": "service-image-normalization-manifest",
  "mode": "stage6-image-ref-normalization",
  "service": {
    "name": "blackbox-exporter",
    "container": "blackbox-exporter",
    "host": "TestServer",
    "image_type": "registry-image",
    "risk_class": "low",
    "compose": {
      "project": "monitoring",
      "service": "blackbox-exporter",
      "project_directory": "/home/james/docker/stacks/monitoring",
      "compose_file": "/home/james/docker/stacks/monitoring/docker-compose.yml",
      "image_variable": "BLACKBOX_EXPORTER_IMAGE"
    }
  },
  "authority": {
    "repository": "docker-env",
    "revision": "d1ca9a5e10d151893573fd97d6a5c282ba912a1e",
    "compose_sha256": "b8a895bd8e23c9f528cf9209f70368be42bf53f8044cbd99ef35eae188e3d68b"
  },
  "image": {
    "version": "0.28.0",
    "repository": "prom/blackbox-exporter",
    "source": {
      "configured_image": "prom/blackbox-exporter:v0.28.0",
      "local_image_id": "sha256:66a289aee116c17f2396de73f97328f55eb4bb8fc53d8842a171eddc54685445"
    },
    "target": {
      "configured_image": "prom/blackbox-exporter@sha256:e753ff9f3fc458d02cca5eddab5a77e1c175eee484a8925ac7d524f04366c2fc",
      "index_digest": "sha256:e753ff9f3fc458d02cca5eddab5a77e1c175eee484a8925ac7d524f04366c2fc",
      "local_image_id": "sha256:66a289aee116c17f2396de73f97328f55eb4bb8fc53d8842a171eddc54685445"
    },
    "rollback": {
      "configured_image": "prom/blackbox-exporter:v0.28.0",
      "local_image_id": "sha256:66a289aee116c17f2396de73f97328f55eb4bb8fc53d8842a171eddc54685445"
    },
    "platform": {
      "os": "linux",
      "architecture": "arm64"
    },
    "same_content_required": true
  },
  "runtime": {
    "networks": [
      "homelab_apps"
    ],
    "published_ports": [
      {
        "host_ip": "192.168.2.220",
        "host_port": 9115,
        "container_port": 9115,
        "protocol": "tcp"
      }
    ],
    "mounts": [
      {
        "type": "bind",
        "source": "/home/james/docker/data/monitoring/blackbox/blackbox.yml",
        "destination": "/etc/blackbox_exporter/config.yml",
        "rw": false,
        "source_kind": "file",
        "sha256": "ab065eba6778f9a0b3b85d1c85712c47b36c342574b9d05f4d29cfa9a7098836"
      }
    ],
    "user": "",
    "privileged": false,
    "readonly_rootfs": false,
    "restart_policy": "unless-stopped",
    "devices_allowed": false,
    "docker_socket_allowed": false,
    "compose_execution": {
      "no_deps": true,
      "no_build": true,
      "pull": "never",
      "force_recreate": true
    }
  },
  "health": {
    "strategy": "http",
    "url": "http://192.168.2.220:9115/-/healthy",
    "expected_status": 200,
    "marker": "Healthy",
    "timeout_seconds": 30
  },
  "protection": {
    "containers": [
      "jenkins",
      "jenkins-docker"
    ],
    "compare": [
      "container_id",
      "restart_count"
    ],
    "all_other_containers_unchanged": true
  },
  "execution": {
    "human_approval_required": true,
    "post_approval_reinspection_required": true,
    "one_shot_required": true,
    "target_must_be_local_before_arm": true,
    "deployment_pull_allowed": false,
    "rollback_required": true,
    "rollback_ref_type": "tagged-source-configuration",
    "normalization_kind": "tag-to-immutable-same-content"
  }
}
